{
  "schema_version": "tool-kb/1",
  "kb_id": "kb-fixture-early",
  "release_id": "fixture-release-0",
  "server_version": "early",
  "cards": [
    {
      "lineage_id": "weather.get_forecast",
      "server_id": "weather",
      "tool_id": "get_forecast",
      "name": "get_forecast",
      "server_version": "early",
      "description": "Return the daily forecast for a city.",
      "input_schema": {
        "type": "object",
        "properties": {
          "city": { "type": "string", "description": "City name." },
          "days": { "type": "integer", "minimum": 1, "maximum": 7 }
        },
        "required": ["city"]
      },
      "output_schema": {
        "type": "object",
        "properties": { "forecast": { "type": "array", "items": { "type": "object" } } }
      },
      "usage_rules": ["Call once per city.", "Prefer days <= 3 for accuracy."],
      "provenance": {
        "release_id": "fixture-release-0",
        "source_file": "catalog/weather/early.json",
        "source_pointer": "/tools/0"
      }
    },
    {
      "lineage_id": "files.read_file",
      "server_id": "files",
      "tool_id": "read_file",
      "name": "read_file",
      "server_version": "early",
      "description": "Read a UTF-8 text file from the sandbox.",
      "input_schema": {
        "type": "object",
        "properties": { "path": { "type": "string" } },
        "required": ["path"]
      },
      "output_schema": null,
      "usage_rules": [],
      "provenance": {
        "release_id": "fixture-release-0",
        "source_file": "catalog/files/early.json",
        "source_pointer": "/tools/0"
      }
    },
    {
      "lineage_id": "tracker.create_issue",
      "server_id": "tracker",
      "tool_id": "create_issue",
      "name": "create_issue",
      "server_version": "early",
      "description": "Create an issue in a project.",
      "input_schema": {
        "type": "object",
        "properties": {
          "project": { "type": "string" },
          "title": { "type": "string" },
          "labels": { "type": "array", "items": { "type": "string" } }
        },
        "required": ["project", "title"]
      },
      "output_schema": { "type": "object", "properties": { "issue_id": { "type": "string" } } },
      "usage_rules": ["Titles must be unique within a project."],
      "provenance": {
        "release_id": "fixture-release-0",
        "source_file": "catalog/tracker/early.json",
        "source_pointer": null
      }
    }
  ]
}
